Enter password: **********
Welcome to the MySQL monitor.  Commands end with ; or \g.
Your MySQL connection id is 19
Server version: 8.0.28 MySQL Community Server - GPL

Copyright (c) 2000, 2022, Oracle and/or its affiliates.

Oracle is a registered trademark of Oracle Corporation and/or its
affiliates. Other names may be trademarks of their respective
owners.

Type 'help;' or '\h' for help. Type '\c' to clear the current input statement.

//UC1 Creating database as AddessBookService

mysql>create database AddressBookService;
Query OK, 1 row affected (0.32 sec)

mysql> show databases;
+--------------------+
| Database           |
+--------------------+
| addressbookservice |
| information_schema |
| mysql              |
| performance_schema |
| sys                |
+--------------------+
5 rows in set (0.05 sec)
mysql> create database AddressBookService;
Query OK, 1 row affected (0.32 sec)

mysql> show databases;
+--------------------+
| Database           |
+--------------------+
| addressbookservice |
| information_schema |
| mysql              |
| performance_schema |
| sys                |
+--------------------+
5 rows in set (0.05 sec)


mysql> use addressbookservice;
Database changed
-------------------------------------------------------------------------------------------------------
//UC2 Creating table as AddressBook with attributes

mysql> create table AddressBook(
    -> firstname varchar(50) not null,
    -> lastname varchar(50) not null,
    -> address varchar(100) not null,
    -> city varchar(50) not null,
    -> state varchar(50) not null,
    -> zip int not null,
    -> phonenumber double not null,
    -> email varchar(100) not null);
Query OK, 0 rows affected (2.29 sec)

mysql> desc AddressBook;
+-------------+--------------+------+-----+---------+-------+
| Field       | Type         | Null | Key | Default | Extra |
+-------------+--------------+------+-----+---------+-------+
| firstname   | varchar(50)  | NO   |     | NULL    |       |
| lastname    | varchar(50)  | NO   |     | NULL    |       |
| address     | varchar(100) | NO   |     | NULL    |       |
| city        | varchar(50)  | NO   |     | NULL    |       |
| state       | varchar(50)  | NO   |     | NULL    |       |
| zip         | int          | NO   |     | NULL    |       |
| phonenumber | double       | NO   |     | NULL    |       |
| email       | varchar(100) | NO   |     | NULL    |       |
+-------------+--------------+------+-----+---------+-------+
8 rows in set (0.13 sec)
--------------------------------------------------------------------------------------------------------
//UC3 inserting new Contacts to AddressBook table

mysql> insert into AddressBook(firstname,lastname,address,city,state,zip,phonenumber,email) values('shubham','pawar','abcd','solapur','maharashtra',413252,8530705596,'shubham.paw@gmail.com');
Query OK, 1 row affected (0.10 sec)

mysql> insert into AddressBook(firstname,lastname,address,city,state,zip,phonenumber,email) values('aishwarya','reddy','bkguda','vizag','andhrapradesh',5073438,9176347439,'maishwarya@gmail.com');
Query OK, 1 row affected (0.24 sec)

mysql> insert into AddressBook(firstname,lastname,address,city,state,zip,phonenumber,email) values('anurag','chow','lonavala','pune','maharashtra',5043438,91763456439,'manurag@gmail.com');
Query OK, 1 row affected (0.19 sec)

mysql> insert into AddressBook(firstname,lastname,address,city,state,zip,phonenumber,email) values('anupama','mall','abcd','bangalore','karnataka',50443438,91763646439,'manupama@gmail.com');
Query OK, 1 row affected (0.19 sec)

mysql> select * from Addressbook;
+-----------+------------+----------+-----------+---------------+----------+--------------+-----------------------+
| firstname | lastname   | address  | city      | state         | zip      | phonenumber  | email                 |
+-----------+------------+----------+-----------+---------------+----------+--------------+-----------------------+
| shubham   | pawar      | abcd     | solapur   | maharashtra   |   413252 | 8530705596   | shubham.paw@gmail.com |
| aishwarya | reddy      | bkguda   | vizag     | andhrapradesh |  5073438 | 9176347439   | maishwarya@gmail.com  |
| anurag    | chow       | lonavala | pune      | maharashtra   |  5043438 | 9176356439   | manurag@gmail.com     |
| anupama   | mall       | abcd     | bangalore | karnataka     | 50443438 | 9176366439   | manupama@gmail.com    |
+-----------+------------+----------+-----------+---------------+----------+-------------+------------------------+

--------------------------------------------------------------------------------------------------------
//UC4 editing the existing contact by their firstname
mysql> update Addressbook set lastname='pawar' where firstname='shubham';
Query OK, 1 row affected (0.06 sec)
Rows matched: 1  Changed: 1  Warnings: 0

mysql> select * from Addressbook;
+-----------+------------+----------+-----------+---------------+----------+--------------+-----------------------+
| firstname | lastname   | address  | city      | state         | zip      | phonenumber  | email                 |
+-----------+------------+----------+-----------+---------------+----------+--------------+-----------------------+
| shubham   | pawar      | abcd     | solapur   | maharashtra   |   413252 | 8530705596   | shubham.paw@gmail.com |
| aishwarya | reddy      | bkguda   | vizag     | andhrapradesh |  5073438 | 9176347439   | maishwarya@gmail.com  |
| anurag    | chow       | lonavala | pune      | maharashtra   |  5043438 | 9176356439   | manurag@gmail.com     |
| anupama   | mall       | abcd     | bangalore | karnataka     | 50443438 | 9176366439   | manupama@gmail.com    |
+-----------+------------+----------+-----------+---------------+----------+-------------+------------------------+
4 rows in set (0.01 sec)
--------------------------------------------------------------------------------------------------------
UC5 -deleting the contact by their lastname

mysql> delete from Addressbook where lastname='reddy';
Query OK, 1 row affected (0.15 sec)

mysql> select * from Addressbook;
+-----------+------------+----------+-----------+---------------+----------+--------------+-----------------------+
| firstname | lastname   | address  | city      | state         | zip      | phonenumber  | email                 |
+-----------+------------+----------+-----------+---------------+----------+--------------+-----------------------+
| shubham   | pawar      | abcd     | solapur   | maharashtra   |   413252 | 8530705596   | shubham.paw@gmail.com |
| anurag    | chow       | lonavala | pune      | maharashtra   |  5043438 | 9176356439   | manurag@gmail.com     |
| anupama   | mall       | abcd     | bangalore | karnataka     | 50443438 | 9176366439   | manupama@gmail.com    |
+-----------+------------+----------+-----------+---------------+----------+-------------+------------------------+
3 rows in set (0.02 sec)
-------------------------------------------------------------------------------------------------------
// UC6 retrieving the contact by city or state

mysql> select * from Addressbook where city='solapur' or state='maharashtra';
+-----------+------------+----------+-----------+---------------+----------+--------------+-----------------------+
| firstname | lastname   | address  | city      | state         | zip      | phonenumber  | email                 |
+-----------+------------+----------+-----------+---------------+----------+--------------+-----------------------+
| shubham   | pawar      | abcd     | solapur   | maharashtra   |   413252 | 8530705596   | shubham.paw@gmail.com |
| anurag    | chow       | lonavala | pune      | maharashtra   |  5043438 | 9176356439   | manurag@gmail.com     |
+-----------+------------+----------+-----------+---------------+----------+-------------+------------------------+
2 rows in set (0.00 sec)
--------------------------------------------------------------------------------------------------------
// UC7 size of addressbook by city and state

 select count(firstname) from Addressbook where city='solapur';
+------------------+
| count(firstname) |
+------------------+
|                1 |
+------------------+
1 row in set (0.00 sec)
mysql> select count(firstname) from Addressbook where state='maharashtra';
+------------------+
| count(firstname) |
+------------------+
|                1 |
+------------------+
1 row in set (0.00 sec)
-------------------------------------------------------------------------------------------------------
// UC8 sorting the name alphbetically for given city

mysql> select firstname,city from Addressbook order by city;
+-----------+-----------+
| firstname | city      |
+-----------+-----------+
| shubham   | solapur   |
| anurag    | pune      |
| anupama   | bangalore |
+-----------+-----------+
3 rows in set (0.00 sec)
------------------------------------------------------------------------------------------------------
// UC9- altering the table with addressbook name and contact type

mysql> alter table Addressbook add bookname varchar(50) not null,add contacttype varchar(50) not null;
Query OK, 0 rows affected (2.62 sec)
Records: 0  Duplicates: 0  Warnings: 0

mysql> desc Addressbook;
+-------------+--------------+------+-----+---------+-------+
| Field       | Type         | Null | Key | Default | Extra |
+-------------+--------------+------+-----+---------+-------+
| firstname   | varchar(50)  | NO   |     | NULL    |       |
| lastname    | varchar(50)  | NO   |     | NULL    |       |
| address     | varchar(100) | NO   |     | NULL    |       |
| city        | varchar(50)  | NO   |     | NULL    |       |
| state       | varchar(50)  | NO   |     | NULL    |       |
| zip         | int          | NO   |     | NULL    |       |
| phonenumber | double       | NO   |     | NULL    |       |
| email       | varchar(100) | NO   |     | NULL    |       |
| bookname    | varchar(50)  | NO   |     | NULL    |       |
| contacttype | varchar(50)  | NO   |     | NULL    |       |
+-------------+--------------+------+-----+---------+-------+
10 rows in set (0.04 sec)
mysql> update Addressbook set bookname ='helloworld',contacttype='friend' where lastname='pawar';
Query OK, 1 row affected (0.06 sec)
Rows matched: 1  Changed: 1  Warnings: 0

mysql> select * from Addressbook;
+-----------+----------+----------+-----------+------------+----------+-------------+-----------------------+------------+-------------+
| firstname | lastname | address  | city      | state      | zip      | phonenumber | email                 | bookname   | contacttype |
+-----------+----------+----------+-----------+------------+----------+-------------+-----------------------+------------+-------------+
| shubham   | pawar    | kurduvadi| solapur   | maharashtra|482001    |8530705596   | shubham.paw@gmail.com | helloworld | friend      |
| anurag    | chow     | lonavala | pune      | maharashtra|482003    |9176356439   | manurag@gmail.com     |            |             |
| anupama   | mall     | abcd     | raipur    | bangalore  |482004    |9176366439   | manurag@gmail.com     |            |             |
+-----------+----------+----------+-----------+------------+----------+-------------+-----------------------+------------+-------------+
3 rows in set (0.02 sec)
mysql> select * from Addressbook where contacttype='friend';
+-----------+----------+---------+-----------+-----------+--------+-------------+-----------------------+------------+-------------+
| firstname | lastname | address | city      | state     | zip    | phonenumber | email                 | bookname   | contacttype |
+-----------+----------+---------+-----------+-----------+--------+-------------+-----------------------+------------+-------------+
| shubham   | pawar    |kurduvadi| solapur   |maharashtra|482001  |8530705596   | shubham.paw@gmail.com | helloworld | friend      |
+-----------+----------+---------+-----------+-----------+--------+-------------+-----------------------+------------+-------------+
1 row in set (0.00 sec)
--------------------------------------------------------------------------------------------------------
//UC10 ability to get count of contacts by contacttype
mysql> select count(firstname) from Addressbook where contacttype='friend';
+------------------+
| count(firstname) |
+------------------+
|                1 |
+------------------+
1 row in set (0.00 sec)
